ETF Name,Issuer,ISIN,CCY,TER(bps),AUM(M),AUM CCY,Date
M&G US Treasury Bond Active UCITS ETF USD Acc,M&G,IE0000DO92H7,USD,15.00,205.93,USD,03/07/2026
M&G Global Maxima Equity UCITS ETF USD Acc,M&G,IE000AEM1K78,USD,55.00,101.24,USD,03/07/2026
M&G UK Index-Linked Gilts Active UCITS ETF GBP Acc,M&G,IE000KEV0H41,GBP,15.00,58.78,GBP,03/07/2026
M&G UK Gilts Active UCITS ETF GBP Acc,M&G,IE000PTM74B6,GBP,15.00,61.52,GBP,03/07/2026
M&G US Treasury Bond Active UCITS ETF GBP-H Acc,M&G,IE000YFPL0I4,GBP,18.00,205.93,GBP,03/07/2026
