ETF Name,Issuer,ISIN,CCY,TER(bps),AUM(M),AUM CCY,Date
M&G US Treasury Bond Active UCITS ETF USD Acc,M&G,IE0000DO92H7,USD,15.00,201.60,USD,30/06/2026
M&G Global Maxima Equity UCITS ETF USD Acc,M&G,IE000AEM1K78,USD,55.00,99.54,USD,30/06/2026
M&G UK Index-Linked Gilts Active UCITS ETF GBP Acc,M&G,IE000KEV0H41,GBP,15.00,58.89,GBP,30/06/2026
M&G UK Gilts Active UCITS ETF GBP Acc,M&G,IE000PTM74B6,GBP,15.00,61.58,GBP,30/06/2026
M&G US Treasury Bond Active UCITS ETF GBP-H Acc,M&G,IE000YFPL0I4,GBP,18.00,201.60,GBP,30/06/2026
,M&G,LU0249326488,,,,,01/07/2026
,M&G,LU0259322260,,,,,01/07/2026
,M&G,LU1750178011,,,,,01/07/2026
