ETF Name,Issuer,ISIN,CCY,TER(bps),AUM(M),AUM CCY,Date
M&G US Treasury Bond Active UCITS ETF USD Acc,M&G,IE0000DO92H7,USD,15.00,206.20,USD,06/07/2026
M&G Global Maxima Equity UCITS ETF USD Acc,M&G,IE000AEM1K78,USD,55.00,101.69,USD,06/07/2026
M&G UK Index-Linked Gilts Active UCITS ETF GBP Acc,M&G,IE000KEV0H41,GBP,15.00,58.63,GBP,06/07/2026
M&G UK Gilts Active UCITS ETF GBP Acc,M&G,IE000PTM74B6,GBP,15.00,61.48,GBP,06/07/2026
M&G US Treasury Bond Active UCITS ETF GBP-H Acc,M&G,IE000YFPL0I4,GBP,18.00,206.20,GBP,06/07/2026
