ETF Name,Issuer,ISIN,CCY,TER(bps),AUM(M),Date
Xtrackers Europe Equity Enhanced Active UCITS ETF 1C,Xtrackers,IE00002ZKAP0,EUR,25.00,57.76,24/06/2026 00:00:00
Xtrackers MSCI World Swap II UCITS ETF 1D,Xtrackers,IE00004DJ199,USD,12.00,0.83,24/06/2026 00:00:00
Xtrackers MSCI USA Information Technology UCITS ETF 1C,Xtrackers,IE0000K7HU41,USD,12.00,1541.47,24/06/2026 00:00:00
Xtrackers MSCI USA ESG UCITS ETF 2C EUR Hedged,Xtrackers,IE0000MMQ5M5,EUR,20.00,7060.03,24/06/2026 00:00:00
Xtrackers Europe Net Zero Pathway Paris Aligned UCITS ETF 1C,Xtrackers,IE0001JH5CB4,EUR,15.00,5.73,24/06/2026 00:00:00
Xtrackers S&P 500 GARP UCITS ETF 1C,Xtrackers,IE0001TLQX55,USD,25.00,3.88,24/06/2026 00:00:00
Xtrackers USD Corporate Green Bond UCITS ETF 1C EUR Hedged,Xtrackers,IE00028H9QJ8,EUR,25.00,53.48,24/06/2026 00:00:00
Xtrackers S&P 500 Equal Weight UCITS ETF 2C EUR Hedged,Xtrackers,IE0002EI5AG0,EUR,30.00,10255.11,24/06/2026 00:00:00
Xtrackers S&P 500 Equal Weight UCITS ETF 3C - CHF Hedged,Xtrackers,IE0002GFATQ6,CHF,30.00,10255.11,24/06/2026 00:00:00
Xtrackers US Equity Enhanced Active UCITS ETF 1C,Xtrackers,IE0002PGSLZ5,USD,20.00,425.61,24/06/2026 00:00:00
Xtrackers USA Net Zero Pathway Paris Aligned UCITS ETF 1C,Xtrackers,IE0002ZM3JI1,USD,10.00,9.46,24/06/2026 00:00:00
Xtrackers MSCI Global SDG 3 Good Health UCITS ETF 1C,Xtrackers,IE00036F4K40,USD,35.00,19.15,24/06/2026 00:00:00
Xtrackers MSCI World Quality ESG UCITS ETF 1C,Xtrackers,IE0003NQ0IY5,USD,25.00,153.31,24/06/2026 00:00:00
Xtrackers USD Corporate Green Bond UCITS ETF 2C,Xtrackers,IE0003W9O921,USD,25.00,53.48,24/06/2026 00:00:00
Xtrackers Nasdaq 100 Swap UCITS ETF 1C,Xtrackers,IE000472H9T4,USD,18.00,5.14,24/06/2026 00:00:00
Xtrackers ESG USD Emerging Markets Bond Quality Weighted UCITS ETF 1C,Xtrackers,IE0004KLW911,USD,45.00,190.64,24/06/2026 00:00:00
Xtrackers S&P 500 Equal Weight Scored & Screened UCITS ETF 1C,Xtrackers,IE0004MFRED4,USD,17.00,2100.78,24/06/2026 00:00:00
Xtrackers MSCI Europe ESG UCITS ETF 1D,Xtrackers,IE0004ZJGWT9,EUR,18.00,999.64,24/06/2026 00:00:00
"Xtrackers MSCI Global SDG 9 Industry, Innovation & Infrastructure UCITS ETF 1C",Xtrackers,IE0005E47AH7,USD,35.00,11.30,24/06/2026 00:00:00
Xtrackers MSCI Japan Climate Transition UCITS ETF 1D,Xtrackers,IE0006FDYJF8,USD,15.00,4.09,24/06/2026 00:00:00
Xtrackers MSCI Innovation UCITS ETF 1C,Xtrackers,IE0006FFX5U1,USD,25.00,4.86,24/06/2026 00:00:00
Xtrackers EUR High Yield Corporate Bond SRI PAB UCITS ETF 1C,Xtrackers,IE0006GNB732,EUR,25.00,37.87,24/06/2026 00:00:00
Xtrackers MSCI USA Consumer Discretionary UCITS ETF 1C,Xtrackers,IE0006I3NZF8,USD,12.00,121.68,24/06/2026 00:00:00
Xtrackers MSCI World ex USA UCITS ETF 1C,Xtrackers,IE0006WW1TQ4,USD,15.00,5132.25,24/06/2026 00:00:00
Xtrackers USD High Yield Corporate Bond Screened UCITS ETF 1C,Xtrackers,IE0006YM7D84,USD,25.00,68.00,24/06/2026 00:00:00
Xtrackers Japan Net Zero Pathway Paris Aligned UCITS ETF 1C,Xtrackers,IE00074JLU02,USD,15.00,155.62,24/06/2026 00:00:00
Xtrackers S&P 500 Scored & Screened UCITS ETF 1C,Xtrackers,IE0007ULOZS8,USD,8.00,100.50,24/06/2026 00:00:00
Xtrackers MSCI Global Clean Water & Sanitation UCITS ETF 1C,Xtrackers,IE0007WJ6B10,USD,35.00,5.84,24/06/2026 00:00:00
Xtrackers MSCI World Minimum Volatility ESG UCITS ETF 1C,Xtrackers,IE0008YN0OY8,USD,25.00,14.51,24/06/2026 00:00:00
Xtrackers World Equity Enhanced Active UCITS ETF 1C,Xtrackers,IE00094GSCQ4,USD,25.00,358.52,24/06/2026 00:00:00
Xtrackers MSCI World UCITS ETF 3C - CHF Hedged,Xtrackers,IE0009KLWT21,CHF,14.00,21658.68,24/06/2026 00:00:00
Xtrackers MSCI Nordic UCITS ETF 1C,Xtrackers,IE000BO2Y0T8,EUR,30.00,961.12,24/06/2026 00:00:00
Xtrackers S&P 500 Equal Weight UCITS ETF 2D,Xtrackers,IE000CXLGK86,USD,15.00,10255.11,24/06/2026 00:00:00
Xtrackers MSCI Emerging Markets Climate Transition UCITS ETF 1C,Xtrackers,IE000DNSAS54,USD,16.00,141.37,24/06/2026 00:00:00
Xtrackers S&P 500 Market Leaders UCITS ETF 1C,Xtrackers,IE000DVHJV46,USD,25.00,4.08,24/06/2026 00:00:00
Xtrackers World Biodiversity Focus SRI UCITS ETF 1C,Xtrackers,IE000E0V65D8,USD,30.00,14.72,24/06/2026 00:00:00
Xtrackers MSCI World ESG UCITS ETF 1D,Xtrackers,IE000E4BATC9,USD,20.00,5406.41,24/06/2026 00:00:00
Xtrackers MSCI Europe Small Cap ESG UCITS ETF 1C,Xtrackers,IE000ER61U30,EUR,25.00,5.94,24/06/2026 00:00:00
Xtrackers MSCI USA Positioning Screened UCITS ETF 1D,Xtrackers,IE000EVOVOG1,USD,12.00,4.66,24/06/2026 00:00:00
Xtrackers Nasdaq 100 Swap UCITS ETF 1D,Xtrackers,IE000EXUE0G2,USD,18.00,5.14,24/06/2026 00:00:00
Xtrackers Floating Rate Notes Active UCITS ETF 1C,Xtrackers,IE000F04HGE5,EUR,12.00,22.75,24/06/2026 00:00:00
Xtrackers MSCI World Small Cap UCITS ETF 1C,Xtrackers,IE000F354Q61,USD,25.00,120.70,24/06/2026 00:00:00
Xtrackers S&P 500 Equal Weight Swap UCITS ETF 1D,Xtrackers,IE000FL46JJ1,USD,12.00,13.53,24/06/2026 00:00:00
Xtrackers S&P 500 Swap II UCITS ETF 1D,Xtrackers,IE000FO05UG4,USD,5.00,3256.49,24/06/2026 00:00:00
Xtrackers S&P 500 Equal Weight Swap UCITS ETF 1C,Xtrackers,IE000FO1A5D1,USD,12.00,13.53,24/06/2026 00:00:00
Xtrackers MSCI USA Swap II UCITS ETF 1D,Xtrackers,IE000FW16TX1,USD,4.00,3.76,24/06/2026 00:00:00
Xtrackers S&P 500 Equal Weight Scored & Screened UCITS ETF 3C - CHF Hedged,Xtrackers,IE000GF6QTP6,CHF,22.00,2100.78,24/06/2026 00:00:00
Xtrackers MSCI Emerging Markets UCITS ETF 1D,Xtrackers,IE000GWA2J58,USD,18.00,10549.42,24/06/2026 00:00:00
Xtrackers MSCI USA Climate Transition UCITS ETF 1D,Xtrackers,IE000GYDNJS5,USD,9.00,7.40,24/06/2026 00:00:00
Xtrackers Nordic Net Zero Pathway Paris Aligned UCITS ETF 1C,Xtrackers,IE000HT7E0B1,EUR,15.00,34.06,24/06/2026 00:00:00
Xtrackers S&P 500 Swap II UCITS ETF 1C,Xtrackers,IE000HY30YW6,USD,5.00,3256.49,24/06/2026 00:00:00
Xtrackers S&P 500 Equal Weight Scored & Screened UCITS ETF 2C - EUR Hedged,Xtrackers,IE000IDLWOL4,EUR,22.00,2100.78,24/06/2026 00:00:00
Xtrackers MSCI World Swap II UCITS ETF 1C,Xtrackers,IE000INYW0A7,USD,12.00,0.83,24/06/2026 00:00:00
Xtrackers MSCI World Small Cap UCITS ETF 1D,Xtrackers,IE000ISS8DB2,USD,25.00,120.70,24/06/2026 00:00:00
Xtrackers MSCI Global SDG 7 Affordable and Clean Energy UCITS ETF 1C,Xtrackers,IE000JZYIUN0,USD,35.00,25.44,24/06/2026 00:00:00
Xtrackers MSCI Genomic Healthcare Innovation UCITS ETF 1C,Xtrackers,IE000KD0BZ68,USD,25.00,7.04,24/06/2026 00:00:00
Xtrackers MSCI Global Social Fairness Contributors UCITS ETF 1C,Xtrackers,IE000L2IS494,USD,35.00,2.84,24/06/2026 00:00:00
Xtrackers FTSE All-World UCITS ETF 1C,Xtrackers,IE000L6ZMMC4,USD,7.00,29.84,24/06/2026 00:00:00
Xtrackers MSCI World Value ESG UCITS ETF 1C,Xtrackers,IE000LAUZQT6,USD,25.00,246.72,24/06/2026 00:00:00
Xtrackers USA Biodiversity Focus SRI UCITS ETF 1C,Xtrackers,IE000LOSV2D0,USD,30.00,9.09,24/06/2026 00:00:00
Xtrackers Global Growth Leaders Active UCITS ETF 1C,Xtrackers,IE000M8F3JA6,USD,50.00,5.42,24/06/2026 00:00:00
Xtrackers EUR Corporate Green Bond UCITS ETF 1C,Xtrackers,IE000MCVFK47,EUR,25.00,153.53,24/06/2026 00:00:00
Xtrackers MSCI Nordic UCITS ETF 2C - GBP Hedged,Xtrackers,IE000MF9SZ46,GBP,35.00,961.12,24/06/2026 00:00:00
Xtrackers S&P 500 Equal Weight UCITS ETF 1D GBP Hedged,Xtrackers,IE000N5GJDD7,GBP,17.00,10255.11,24/06/2026 00:00:00
Xtrackers MSCI Europe Climate Transition UCITS ETF 1C,Xtrackers,IE000N9MLVT1,EUR,12.00,14.50,24/06/2026 00:00:00
Xtrackers MSCI World High Dividend Yield ESG UCITS ETF 1D,Xtrackers,IE000NS5HRY9,USD,25.00,25.00,24/06/2026 00:00:00
Xtrackers Electrification Technologies & Smart Grid UCITS ETF 1C,Xtrackers,IE000O7Q2E56,USD,35.00,53.06,24/06/2026 00:00:00
Xtrackers MSCI World UCITS ETF 2C - EUR Hedged,Xtrackers,IE000ONQ3X90,EUR,14.00,21658.68,24/06/2026 00:00:00
Xtrackers MSCI World Climate Transition UCITS ETF 1C,Xtrackers,IE000P4AYI47,USD,19.00,18.47,24/06/2026 00:00:00
Xtrackers MSCI USA Swap II UCITS ETF 1C,Xtrackers,IE000PDUVTF3,USD,4.00,3.76,24/06/2026 00:00:00
Xtrackers MSCI Global SDGs UCITS ETF 1C,Xtrackers,IE000PSF3A70,USD,35.00,5.66,24/06/2026 00:00:00
Xtrackers India Government Bond UCITS ETF 1C,Xtrackers,IE000QVYFUT7,USD,33.00,40.08,24/06/2026 00:00:00
Xtrackers MSCI USA Health Care UCITS ETF 1C,Xtrackers,IE000RNHIKK1,USD,12.00,635.02,24/06/2026 00:00:00
Xtrackers S&P 500 Defensive Shareholder Yield UCITS ETF 1C,Xtrackers,IE000SRQBBT6,USD,25.00,4.87,24/06/2026 00:00:00
Xtrackers S&P 500 Equal Weight Scored & Screened UCITS ETF 4C - GBP Hedged,Xtrackers,IE000SZ25OI0,GBP,22.00,2100.78,24/06/2026 00:00:00
Xtrackers MSCI World Momentum ESG UCITS ETF 1C,Xtrackers,IE000TL3PL69,USD,25.00,237.58,24/06/2026 00:00:00
Xtrackers MSCI USA Screened UCITS ETF 2C EUR Hedged,Xtrackers,IE000TSML5I8,EUR,12.00,822.94,24/06/2026 00:00:00
Xtrackers Emerging Markets Net Zero Pathway Paris Aligned UCITS ETF 1C,Xtrackers,IE000TZT8TI0,USD,20.00,13.70,24/06/2026 00:00:00
Xtrackers MSCI World Small Cap ESG UCITS ETF 1C,Xtrackers,IE000UATQPE2,USD,25.00,7.86,24/06/2026 00:00:00
Xtrackers MSCI USA ESG UCITS ETF 1D,Xtrackers,IE000UMV0L21,USD,15.00,7060.03,24/06/2026 00:00:00
Xtrackers S&P 500 UCITS ETF 4D,Xtrackers,IE000UP2BIZ9,USD,3.00,2177.76,24/06/2026 00:00:00
Xtrackers iBoxx EUR Corporate Bond Yield Plus UCITS ETF 1C,Xtrackers,IE000UX5WPU4,EUR,25.00,525.60,24/06/2026 00:00:00
Xtrackers World Net Zero Pathway Paris Aligned UCITS ETF 1C,Xtrackers,IE000UZCJS58,USD,19.00,102.51,24/06/2026 00:00:00
Xtrackers MSCI USA High Dividend Yield ESG UCITS ETF 1D,Xtrackers,IE000V04SL39,USD,25.00,5.53,24/06/2026 00:00:00
Xtrackers MSCI Global SDG 11 Sustainable Cities UCITS ETF 1C,Xtrackers,IE000V0GDVU7,USD,35.00,5.83,24/06/2026 00:00:00
Xtrackers MSCI EMU High Dividend Yield ESG UCITS ETF 1D,Xtrackers,IE000VCBWFL8,EUR,25.00,17.99,24/06/2026 00:00:00
Xtrackers MSCI AC World Screened UCITS ETF 2C EUR Hedged,Xtrackers,IE000VXC51U5,EUR,37.00,5112.06,24/06/2026 00:00:00
Xtrackers MSCI EMU Climate Transition UCITS ETF 1C,Xtrackers,IE000W6L2AI3,EUR,12.00,15.30,24/06/2026 00:00:00
Xtrackers MSCI AC World Screened UCITS ETF 5C USD Hedged,Xtrackers,IE000WGF1X01,USD,37.00,5112.06,24/06/2026 00:00:00
Xtrackers USD High Yield Corporate Bond Screened UCITS ETF 2C - GBP Hedged,Xtrackers,IE000WHO5BF2,GBP,30.00,68.00,24/06/2026 00:00:00
Xtrackers MSCI Europe High Dividend Yield ESG UCITS ETF 1D,Xtrackers,IE000WQ16XQ4,EUR,25.00,30.03,24/06/2026 00:00:00
Xtrackers MSCI World IMI UCITS ETF 1C,Xtrackers,IE000X1GW0A7,USD,15.00,10.50,24/06/2026 00:00:00
Xtrackers Global Equity Top Active UCITS ETF 1C,Xtrackers,IE000X4A4GV2,USD,35.00,5.42,24/06/2026 00:00:00
Xtrackers MSCI USA Financials UCITS ETF 1C,Xtrackers,IE000X5MRP46,USD,12.00,559.36,24/06/2026 00:00:00
Xtrackers USD Corporate Green Bond UCITS ETF 1D GBP Hedged,Xtrackers,IE000X63FXN4,GBP,25.00,53.48,24/06/2026 00:00:00
Xtrackers MSCI USA Consumer Staples UCITS ETF 1C,Xtrackers,IE000X6Z71P5,USD,12.00,79.33,24/06/2026 00:00:00
Xtrackers MSCI Next Generation Internet Innovation UCITS ETF 1C,Xtrackers,IE000XOQ9TK4,USD,30.00,55.21,24/06/2026 00:00:00
Xtrackers EMU Net Zero Pathway Paris Aligned UCITS ETF 1C,Xtrackers,IE000Y6L6LE6,EUR,15.00,7.78,24/06/2026 00:00:00
Xtrackers MSCI Global Circular Economy UCITS ETF 1C,Xtrackers,IE000Y6ZXZ48,USD,35.00,6.26,24/06/2026 00:00:00
Xtrackers MSCI Fintech Innovation UCITS ETF 1C,Xtrackers,IE000YDOORK7,USD,30.00,9.01,24/06/2026 00:00:00
Xtrackers FTSE All-World ex US UCITS ETF 1C,Xtrackers,IE000YKHGYN2,USD,15.00,23.69,24/06/2026 00:00:00
Xtrackers MSCI World ex USA UCITS ETF 1D,Xtrackers,IE000Z0FC0G5,USD,15.00,5132.25,24/06/2026 00:00:00
Xtrackers S&P 500 UCITS ETF 4C,Xtrackers,IE000Z9SJA06,USD,3.00,2177.76,24/06/2026 00:00:00
Xtrackers Portfolio Income UCITS ETF 1D,Xtrackers,IE00B3Y8D011,EUR,65.00,51.27,24/06/2026 00:00:00
Xtrackers S&P 500 UCITS ETF 3C CHF Hedged,Xtrackers,IE00B8KMSQ34,CHF,5.00,2177.76,24/06/2026 00:00:00
Xtrackers MSCI Nordic UCITS ETF 1D,Xtrackers,IE00B9MRHC27,EUR,30.00,961.12,24/06/2026 00:00:00
Xtrackers MDAX ESG Screened UCITS ETF 1D,Xtrackers,IE00B9MRJJ36,EUR,40.00,81.54,24/06/2026 00:00:00
Xtrackers MSCI World Screened UCITS ETF 1D,Xtrackers,IE00BCHWNQ94,USD,19.00,175.64,24/06/2026 00:00:00
Xtrackers MSCI USA Energy UCITS ETF 1D,Xtrackers,IE00BCHWNS19,USD,12.00,89.65,24/06/2026 00:00:00
Xtrackers MSCI USA Financials UCITS ETF 1D,Xtrackers,IE00BCHWNT26,USD,12.00,559.36,24/06/2026 00:00:00
Xtrackers MSCI USA Industrials UCITS ETF 1D,Xtrackers,IE00BCHWNV48,USD,12.00,250.23,24/06/2026 00:00:00
Xtrackers MSCI USA Health Care UCITS ETF 1D,Xtrackers,IE00BCHWNW54,USD,12.00,635.02,24/06/2026 00:00:00
Xtrackers ESG USD Emerging Markets Bond Quality Weighted UCITS ETF 1D,Xtrackers,IE00BD4DX952,USD,45.00,190.64,24/06/2026 00:00:00
Xtrackers ESG USD Emerging Markets Bond Quality Weighted UCITS ETF 2D EUR Hedged,Xtrackers,IE00BD4DXB77,EUR,50.00,190.64,24/06/2026 00:00:00
Xtrackers MSCI USA Minimum Volatility UCITS ETF 1D,Xtrackers,IE00BDB7J586,USD,20.00,3.45,24/06/2026 00:00:00
Xtrackers MSCI EMU Screened UCITS ETF 1D,Xtrackers,IE00BDGN9Z19,EUR,12.00,10.38,24/06/2026 00:00:00
Xtrackers USD High Yield Corporate Bond UCITS ETF 1D,Xtrackers,IE00BDR5HM97,USD,20.00,682.69,24/06/2026 00:00:00
Xtrackers USD High Yield Corporate Bond UCITS ETF 1C,Xtrackers,IE00BDR5HN05,USD,20.00,682.69,24/06/2026 00:00:00
Xtrackers MSCI USA Banks UCITS ETF 1D,Xtrackers,IE00BDVPTJ63,USD,12.00,21.42,24/06/2026 00:00:00
Xtrackers USD Corporate Bond Short Duration SRI PAB UCITS ETF 1D,Xtrackers,IE00BF8J5974,USD,16.00,91.94,24/06/2026 00:00:00
Xtrackers USD Corporate Bond Short Duration SRI PAB UCITS ETF 2C EUR Hedged,Xtrackers,IE00BFMKQ930,EUR,21.00,91.94,24/06/2026 00:00:00
Xtrackers USD Corporate Bond UCITS ETF 1C,Xtrackers,IE00BFMKQC67,USD,12.00,1044.42,24/06/2026 00:00:00
Xtrackers MSCI Europe ESG UCITS ETF 1C,Xtrackers,IE00BFMNHK08,EUR,20.00,999.64,24/06/2026 00:00:00
Xtrackers MSCI USA ESG UCITS ETF 1C,Xtrackers,IE00BFMNPS42,USD,15.00,7060.03,24/06/2026 00:00:00
Xtrackers USD High Yield Corporate Bond UCITS ETF 2C EUR Hedged,Xtrackers,IE00BG04LT92,EUR,25.00,682.69,24/06/2026 00:00:00
Xtrackers USD High Yield Corporate Bond UCITS ETF 4D GBP Hedged,Xtrackers,IE00BG04LV15,GBP,20.00,682.69,24/06/2026 00:00:00
Xtrackers USD Corporate Bond UCITS ETF 5D - GBP Hedged,Xtrackers,IE00BG04LY46,GBP,21.00,1044.42,24/06/2026 00:00:00
Xtrackers MSCI USA UCITS ETF 3C - CHF Hedged,Xtrackers,IE00BG04LZ52,CHF,8.00,10561.71,24/06/2026 00:00:00
Xtrackers MSCI USA UCITS ETF 2C - EUR Hedged,Xtrackers,IE00BG04M077,EUR,8.00,10561.71,24/06/2026 00:00:00
Xtrackers MSCI Japan ESG UCITS ETF 1C,Xtrackers,IE00BG36TC12,USD,20.00,2457.91,24/06/2026 00:00:00
Xtrackers MSCI Emerging Markets ESG UCITS ETF 1C,Xtrackers,IE00BG370F43,USD,25.00,1217.06,24/06/2026 00:00:00
Xtrackers MSCI AC World Screened UCITS ETF 1C,Xtrackers,IE00BGHQ0G80,EUR,25.00,5112.06,24/06/2026 00:00:00
Xtrackers S&P 500 UCITS ETF 1D EUR Hedged,Xtrackers,IE00BGJWX091,EUR,5.00,2177.76,24/06/2026 00:00:00
Xtrackers MSCI USA Consumer Staples UCITS ETF 1D,Xtrackers,IE00BGQYRQ28,USD,12.00,79.33,24/06/2026 00:00:00
Xtrackers MSCI USA Consumer Discretionary UCITS ETF 1D,Xtrackers,IE00BGQYRR35,USD,12.00,121.68,24/06/2026 00:00:00
Xtrackers MSCI USA Information Technology UCITS ETF 1D,Xtrackers,IE00BGQYRS42,USD,12.00,1541.47,24/06/2026 00:00:00
Xtrackers S&P Europe ex UK UCITS ETF 1D,Xtrackers,IE00BGV5VM45,EUR,9.00,225.92,24/06/2026 00:00:00
Xtrackers Artificial Intelligence & Big Data UCITS ETF 1C,Xtrackers,IE00BGV5VN51,USD,35.00,6651.56,24/06/2026 00:00:00
Xtrackers Future Mobility UCITS ETF 1C,Xtrackers,IE00BGV5VR99,USD,35.00,164.06,24/06/2026 00:00:00
Xtrackers MSCI North America High Dividend Yield UCITS ETF 1C,Xtrackers,IE00BH361H73,USD,39.00,102.18,24/06/2026 00:00:00
Xtrackers MSCI World UCITS ETF 1C,Xtrackers,IE00BJ0KDQ92,USD,12.00,21658.68,24/06/2026 00:00:00
Xtrackers MSCI USA UCITS ETF 1C,Xtrackers,IE00BJ0KDR00,USD,3.00,10561.71,24/06/2026 00:00:00
Xtrackers MSCI USA Screened UCITS ETF 1C,Xtrackers,IE00BJZ2DC62,USD,7.00,822.94,24/06/2026 00:00:00
Xtrackers Russell 2000 UCITS ETF 1C,Xtrackers,IE00BJZ2DD79,USD,30.00,2281.72,24/06/2026 00:00:00
Xtrackers MSCI USA UCITS ETF 1D,Xtrackers,IE00BK1PV445,USD,3.00,10561.71,24/06/2026 00:00:00
Xtrackers MSCI World UCITS ETF 1D,Xtrackers,IE00BK1PV551,USD,12.00,21658.68,24/06/2026 00:00:00
Xtrackers MSCI World Quality UCITS ETF 1C,Xtrackers,IE00BL25JL35,USD,25.00,2316.42,24/06/2026 00:00:00
Xtrackers MSCI World Value UCITS ETF 1C,Xtrackers,IE00BL25JM42,USD,25.00,3696.10,24/06/2026 00:00:00
Xtrackers MSCI World Minimum Volatility UCITS ETF 1C,Xtrackers,IE00BL25JN58,USD,25.00,885.80,24/06/2026 00:00:00
Xtrackers MSCI World Momentum UCITS ETF 1C,Xtrackers,IE00BL25JP72,USD,25.00,1710.58,24/06/2026 00:00:00
Xtrackers USD Corporate Bond SRI PAB UCITS ETF 1C,Xtrackers,IE00BL58LJ19,USD,16.00,222.61,24/06/2026 00:00:00
Xtrackers USD Corporate Bond SRI PAB UCITS ETF 2C EUR Hedged,Xtrackers,IE00BL58LL31,EUR,21.00,222.61,24/06/2026 00:00:00
Xtrackers S&P 500 Equal Weight UCITS ETF 1C,Xtrackers,IE00BLNMYC90,USD,15.00,10255.11,24/06/2026 00:00:00
Xtrackers MSCI Emerging Markets ex China UCITS ETF 1C,Xtrackers,IE00BM67HJ62,GBP,16.00,121.31,24/06/2026 00:00:00
Xtrackers MSCI World Health Care UCITS ETF 1C,Xtrackers,IE00BM67HK77,USD,25.00,2583.81,24/06/2026 00:00:00
Xtrackers MSCI World Financials UCITS ETF 1C,Xtrackers,IE00BM67HL84,USD,25.00,693.16,24/06/2026 00:00:00
Xtrackers MSCI World Energy UCITS ETF 1C,Xtrackers,IE00BM67HM91,USD,25.00,1343.40,24/06/2026 00:00:00
Xtrackers MSCI World Consumer Staples UCITS ETF 1C,Xtrackers,IE00BM67HN09,USD,25.00,675.43,24/06/2026 00:00:00
Xtrackers MSCI World Consumer Discretionary UCITS ETF 1C,Xtrackers,IE00BM67HP23,USD,25.00,243.09,24/06/2026 00:00:00
Xtrackers MSCI World Utilities UCITS ETF 1C,Xtrackers,IE00BM67HQ30,USD,25.00,702.83,24/06/2026 00:00:00
Xtrackers MSCI World Communication Services UCITS ETF 1C,Xtrackers,IE00BM67HR47,USD,25.00,361.10,24/06/2026 00:00:00
Xtrackers MSCI World Materials UCITS ETF 1C,Xtrackers,IE00BM67HS53,USD,25.00,565.87,24/06/2026 00:00:00
Xtrackers MSCI World Information Technology UCITS ETF 1C,Xtrackers,IE00BM67HT60,USD,25.00,4694.08,24/06/2026 00:00:00
Xtrackers MSCI World Industrials UCITS ETF 1C,Xtrackers,IE00BM67HV82,USD,25.00,773.05,24/06/2026 00:00:00
Xtrackers S&P 500 UCITS ETF 1C EUR Hedged,Xtrackers,IE00BM67HW99,EUR,5.00,2177.76,24/06/2026 00:00:00
Xtrackers S&P 500 UCITS ETF 2C GBP Hedged,Xtrackers,IE00BM67HX07,GBP,5.00,2177.76,24/06/2026 00:00:00
Xtrackers US Treasuries Ultrashort Bond UCITS ETF 1C,Xtrackers,IE00BM97MR69,USD,6.00,231.35,24/06/2026 00:00:00
Xtrackers US Treasuries Ultrashort Bond UCITS ETF 3C MXN Hedged,Xtrackers,IE00BM97MV06,MXN,9.00,231.35,24/06/2026 00:00:00
Xtrackers USD Corporate Bond UCITS ETF 6C MXN Hedged,Xtrackers,IE00BMCFJ320,MXN,21.00,1044.42,24/06/2026 00:00:00
Xtrackers NASDAQ 100 UCITS ETF 1C,Xtrackers,IE00BMFKG444,USD,20.00,1864.82,24/06/2026 00:00:00
Xtrackers MSCI World ESG UCITS ETF 2C EUR Hedged,Xtrackers,IE00BMY76136,EUR,25.00,5406.41,24/06/2026 00:00:00
Xtrackers Developed Green Real Estate ESG UCITS ETF 1C,Xtrackers,IE00BN2BCY94,USD,18.00,8.80,24/06/2026 00:00:00
Xtrackers MSCI EMU ESG UCITS ETF 1C,Xtrackers,IE00BNC1G699,EUR,20.00,30.86,24/06/2026 00:00:00
Xtrackers MSCI USA Communication Services UCITS ETF 1D,Xtrackers,IE00BNC1G707,USD,12.00,631.79,24/06/2026 00:00:00
Xtrackers Stoxx European Market Leaders UCITS ETF 1C,Xtrackers,IE00BNKF6C99,EUR,25.00,6.17,24/06/2026 00:00:00
Xtrackers FTSE Developed Europe ex UK Real Estate UCITS ETF 1C,Xtrackers,IE00BP8FKB21,EUR,33.00,16.30,24/06/2026 00:00:00
Xtrackers MSCI Japan Screened UCITS ETF 1D,Xtrackers,IE00BPVLQD13,JPY,15.00,381.24,24/06/2026 00:00:00
Xtrackers MSCI Japan Screened UCITS ETF 2D GBP Hedged,Xtrackers,IE00BPVLQF37,GBP,25.00,381.24,24/06/2026 00:00:00
Xtrackers MSCI GCC Select Swap UCITS ETF 1C,Xtrackers,IE00BQXKVQ19,USD,65.00,20.40,24/06/2026 00:00:00
Xtrackers MSCI Japan Screened UCITS ETF 3C EUR Hedged,Xtrackers,IE00BRB36B93,EUR,25.00,381.24,24/06/2026 00:00:00
Xtrackers MSCI Japan Screened UCITS ETF 4C USD Hedged,Xtrackers,IE00BTGD1B38,USD,25.00,381.24,24/06/2026 00:00:00
Xtrackers MSCI Emerging Markets UCITS ETF 1C,Xtrackers,IE00BTJRMP35,USD,18.00,10549.42,24/06/2026 00:00:00
Xtrackers iBoxx EUR Corporate Bond Yield Plus UCITS ETF 1D,Xtrackers,IE00BYPHT736,EUR,25.00,525.60,24/06/2026 00:00:00
Xtrackers Global Infrastructure ESG UCITS ETF 1C,Xtrackers,IE00BYZNF849,USD,35.00,9.45,24/06/2026 00:00:00
Xtrackers MSCI World ESG UCITS ETF 1C,Xtrackers,IE00BZ02LR44,USD,20.00,5406.41,24/06/2026 00:00:00
Xtrackers USD Corporate Bond UCITS ETF 1D,Xtrackers,IE00BZ036H21,USD,12.00,1044.42,24/06/2026 00:00:00
Xtrackers USD Corporate Bond UCITS ETF 2D EUR Hedged,Xtrackers,IE00BZ036J45,EUR,21.00,1044.42,24/06/2026 00:00:00
Xtrackers MSCI World UCITS ETF 2D GBP Hedged,Xtrackers,IE00BZ1BS790,GBP,14.00,21658.68,24/06/2026 00:00:00
Xtrackers MSCI World Swap UCITS ETF 1C,Xtrackers,LU0274208692,USD,45.00,10508.98,24/06/2026 00:00:00
Xtrackers MSCI Europe UCITS ETF 1C,Xtrackers,LU0274209237,USD,12.00,7353.20,24/06/2026 00:00:00
Xtrackers MSCI Japan UCITS ETF 1C,Xtrackers,LU0274209740,USD,12.00,5939.16,24/06/2026 00:00:00
Xtrackers MSCI USA Swap UCITS ETF 1C,Xtrackers,LU0274210672,USD,15.00,6420.36,24/06/2026 00:00:00
Xtrackers Euro Stoxx 50 UCITS ETF 1D,Xtrackers,LU0274211217,EUR,9.00,10461.77,24/06/2026 00:00:00
Xtrackers DAX UCITS ETF 1C,Xtrackers,LU0274211480,EUR,9.00,6109.53,24/06/2026 00:00:00
Xtrackers FTSE MIB UCITS ETF 1D,Xtrackers,LU0274212538,EUR,30.00,81.47,24/06/2026 00:00:00
Xtrackers Switzerland UCITS ETF 1D,Xtrackers,LU0274221281,CHF,30.00,2103.04,24/06/2026 00:00:00
Xtrackers II Eurozone Government Bond UCITS ETF 1C,Xtrackers,LU0290355717,EUR,7.00,2622.53,24/06/2026 00:00:00
Xtrackers II Eurozone Government Bond 1-3 UCITS ETF 1C,Xtrackers,LU0290356871,EUR,10.00,3034.03,24/06/2026 00:00:00
Xtrackers II Eurozone Government Bond 3-5 UCITS ETF 1C,Xtrackers,LU0290356954,EUR,15.00,475.33,24/06/2026 00:00:00
Xtrackers II Eurozone Government Bond 5-7 UCITS ETF 1C,Xtrackers,LU0290357176,EUR,15.00,859.77,24/06/2026 00:00:00
Xtrackers II Eurozone Government Bond 7-10 UCITS ETF 1C,Xtrackers,LU0290357259,EUR,15.00,1721.29,24/06/2026 00:00:00
Xtrackers II Eurozone Government Bond 15-30 UCITS ETF 1C,Xtrackers,LU0290357507,EUR,15.00,63.39,24/06/2026 00:00:00
Xtrackers II Eurozone Government Bond 25+ UCITS ETF 1C,Xtrackers,LU0290357846,EUR,15.00,94.72,24/06/2026 00:00:00
Xtrackers II Global Inflation-Linked Bond UCITS ETF 1C EUR Hedged,Xtrackers,LU0290357929,EUR,25.00,786.12,24/06/2026 00:00:00
Xtrackers II Eurozone Inflation-Linked Bond UCITS ETF 1C,Xtrackers,LU0290358224,EUR,15.00,344.48,24/06/2026 00:00:00
Xtrackers II EUR Overnight Rate Swap UCITS ETF 1C,Xtrackers,LU0290358497,EUR,10.00,19371.55,24/06/2026 00:00:00
Xtrackers Euro Stoxx Quality Dividend UCITS ETF 1D,Xtrackers,LU0292095535,EUR,30.00,637.52,24/06/2026 00:00:00
Xtrackers Stoxx Global Select Dividend 100 Swap UCITS ETF 1D,Xtrackers,LU0292096186,EUR,50.00,811.93,24/06/2026 00:00:00
Xtrackers FTSE 100 Income UCITS ETF 1D,Xtrackers,LU0292097234,GBP,9.00,84.70,24/06/2026 00:00:00
Xtrackers FTSE 250 UCITS ETF 1D,Xtrackers,LU0292097317,GBP,15.00,30.07,24/06/2026 00:00:00
Xtrackers MSCI UK ESG UCITS ETF 1D,Xtrackers,LU0292097747,GBP,18.00,673.84,24/06/2026 00:00:00
Xtrackers MSCI Korea UCITS ETF 1C,Xtrackers,LU0292100046,USD,45.00,398.48,24/06/2026 00:00:00
Xtrackers MSCI Europe Materials UCITS ETF 1C,Xtrackers,LU0292100806,EUR,17.00,35.47,24/06/2026 00:00:00
Xtrackers MSCI Europe Health Care UCITS ETF 1C,Xtrackers,LU0292103222,EUR,17.00,281.10,24/06/2026 00:00:00
Xtrackers MSCI Europe Financials UCITS ETF 1C,Xtrackers,LU0292103651,EUR,17.00,127.28,24/06/2026 00:00:00
Xtrackers MSCI Europe Communication Services UCITS ETF 1C,Xtrackers,LU0292104030,EUR,17.00,12.77,24/06/2026 00:00:00
Xtrackers MSCI Europe Information Technology UCITS ETF 1C,Xtrackers,LU0292104469,EUR,17.00,32.03,24/06/2026 00:00:00
Xtrackers MSCI Europe Utilities UCITS ETF 1C,Xtrackers,LU0292104899,EUR,17.00,66.20,24/06/2026 00:00:00
Xtrackers MSCI Europe Consumer Staples UCITS ETF 1C,Xtrackers,LU0292105359,EUR,17.00,43.09,24/06/2026 00:00:00
Xtrackers MSCI Europe Industrials UCITS ETF 1C,Xtrackers,LU0292106084,EUR,17.00,31.82,24/06/2026 00:00:00
Xtrackers Bloomberg Commodity ex-Agriculture & Livestock Swap UCITS ETF 1C EUR Hedged,Xtrackers,LU0292106167,EUR,39.00,535.14,24/06/2026 00:00:00
Xtrackers ShortDAX Daily Swap UCITS ETF 1C,Xtrackers,LU0292106241,EUR,40.00,139.33,24/06/2026 00:00:00
Xtrackers Euro Stoxx 50 Short Daily Swap UCITS ETF 1C,Xtrackers,LU0292106753,EUR,40.00,26.66,24/06/2026 00:00:00
Xtrackers MSCI Emerging Markets Swap UCITS ETF 1C,Xtrackers,LU0292107645,USD,49.00,952.52,24/06/2026 00:00:00
Xtrackers MSCI EM Asia Screened Swap UCITS ETF 1C,Xtrackers,LU0292107991,USD,65.00,600.49,24/06/2026 00:00:00
Xtrackers MSCI EM Latin America Swap UCITS ETF 1C,Xtrackers,LU0292108619,USD,40.00,97.17,24/06/2026 00:00:00
"Xtrackers MSCI EM Europe, Middle East & Africa ESG Swap UCITS ETF 1C",Xtrackers,LU0292109005,USD,65.00,30.59,24/06/2026 00:00:00
Xtrackers MSCI Taiwan UCITS ETF 1C,Xtrackers,LU0292109187,USD,65.00,383.06,24/06/2026 00:00:00
Xtrackers MSCI Brazil UCITS ETF 1C,Xtrackers,LU0292109344,USD,25.00,185.90,24/06/2026 00:00:00
Xtrackers Nifty 50 Swap UCITS ETF 1C,Xtrackers,LU0292109690,USD,85.00,136.33,24/06/2026 00:00:00
Xtrackers MSCI China A UCITS ETF 1C,Xtrackers,LU0292109856,USD,35.00,106.48,24/06/2026 00:00:00
Xtrackers II iTraxx Crossover Short Daily Swap UCITS ETF 1C,Xtrackers,LU0321462870,EUR,24.00,18.38,24/06/2026 00:00:00
Xtrackers II J.P. Morgan USD Emerging Markets Bond UCITS ETF 1C EUR Hedged,Xtrackers,LU0321462953,EUR,40.00,352.14,24/06/2026 00:00:00
Xtrackers II GBP Overnight Rate Swap UCITS ETF 1D,Xtrackers,LU0321464652,GBP,10.00,192.40,24/06/2026 00:00:00
Xtrackers II USD Overnight Rate Swap UCITS ETF 1C,Xtrackers,LU0321465469,USD,10.00,243.49,24/06/2026 00:00:00
Xtrackers SLI UCITS ETF 1D,Xtrackers,LU0322248146,CHF,25.00,417.47,24/06/2026 00:00:00
Xtrackers LPX Private Equity Swap UCITS ETF 1C,Xtrackers,LU0322250712,EUR,70.00,234.29,24/06/2026 00:00:00
